Поле,Опис
**certificatesErrors**/**productsErrors**,"об'єкт; починається з номера *рядка сертифіката / рядка тварної позиції (відповідно)*, де була допущена помилка. Містить параметри:

* **errorType** - тип помилки:
   * 1 - Незаповнене обов'язкове поле, для цього значення помилка може містити поле **cause** (причина чому воно має бути обов'язкове, як у випадку з Дата закінчення дії або Номер партії;
   * 2 - Некоректне значення поля, для цього поля також є поле **allowedValues**, це для помилки з Ім'ям файлу; для цього значення помилка може містити поле **fileName**;
   * 3 - Файл з іменем файла вказаним в колонці Імя файлу не знайдено в zip-архіві; для цього значення помилка може містити поле **fileName**;
   * 4 - Файл з іменем файла вказаним в колонці Імя файлу занадто великий; для цього значення помилка може містити поле **fileName**.
* **columnName** - назва колонки;"
**createdCertificates**,масив; номера створених сертифікатів
**existedCertificates**,масив; номера існуючих сертифікатів
**certsCount** - кількість сертифікатів (рядків на 1-му листі xls/xlsx-файлу)
**productsCount** - кількість товарних позицій (рядків на 2-му листі xls/xlsx-файлу)